Symbol,Name,Last Sale,Net Change,% Change,Market Cap,Country,IPO Year,Volume,Sector,Industry
JMPNL,JMP Group LLC 7.25% Senior Notes due 2027,$25.48,0.02,0.079%,0.00,United States,,312,Finance,Investment Bankers/Brokers/Service
JMPNZ,JMP Group LLC 6.875% Senior Notes due 2029,$24.36,0.2397,0.994%,0.00,United States,,1531,Finance,Investment Bankers/Brokers/Service
JNCE,Jounce Therapeutics Inc. Common Stock,$12.25,-1.62,-11.68%,556071122.00,United States,2017,848897,Health Care,Biotechnology: Biological Products (No Diagnostic Substances)
JOAN,JOANN Inc. Common Stock,$12.25,0.25,2.083%,494546343.00,United States,,5433889,,
JOBS,51job Inc. American Depositary Shares,$64.11,-0.60,-0.927%,4321048427.00,China,2004,123864,Technology,Diversified Commercial Services
JOFFU,JOFF Fintech Acquisition Corp. Unit,$10.18,0.06,0.593%,0.00,United States,2021,153834,Finance,Business Services
JOUT,Johnson Outdoors Inc. Class A Common Stock,$146.22,2.02,1.401%,1478601790.00,United States,,43816,Consumer Non-Durables,Recreational Products/Toys
JRJC,China Finance Online Co. Limited American Depositary Shares,$11.65,0.44,3.925%,28448834.00,China,2004,15671,Finance,Investment Bankers/Brokers/Service
JRSH,Jerash Holdings (US) Inc. Common Stock,$6.2999,0.0598,0.958%,71346368.00,United States,2018,7991,Consumer Non-Durables,Apparel
JRVR,James River Group Holdings Ltd. Common Shares,$47.46,0.48,1.022%,1460131105.00,Bermuda,2014,164057,Finance,Property-Casualty Insurers
JSM,Navient Corporation 6% Senior Notes due December 15 2043,$23.8593,0.3493,1.486%,0.00,United States,,8071,Finance,Finance: Consumer Services
JUPW,Jupiter Wellness Inc. Common Stock,$5.81,-0.01,-0.172%,53349355.00,United States,2020,265376,Consumer Non-Durables,Package Goods/Cosmetics
JUPWW,Jupiter Wellness Inc. Warrant,$0.92,-0.0401,-4.177%,0.00,United States,2020,3211,Consumer Non-Durables,Package Goods/Cosmetics
JVA,Coffee Holding Co. Inc. Common Stock,$5.02,0.02,0.40%,28657167.00,United States,2005,22579,Consumer Non-Durables,Packaged Foods
JYAC,Jiya Acquisition Corp. Class A Common Stock,$10.18,0.055,0.543%,139741267.00,United States,2020,857,Finance,Business Services
JYNT,The Joint Corp. Common Stock,$46.78,1.46,3.222%,661464101.00,United States,2014,167466,Miscellaneous,Multi-Sector Companies
KAIIU,Kismet Acquisition Two Corp. Unit,$10.01,0.01,0.10%,0.00,United States,2021,1798,Finance,Business Services
KAIR,Kairos Acquisition Corp. Class A Ordinary Shares,$9.78,-0.14,-1.411%,0.00,United States,2021,45163,Finance,Business Services
KAIRU,Kairos Acquisition Corp. Unit,$10.19,-0.02,-0.196%,0.00,United States,2021,50816,Finance,Business Services
KAIRW,Kairos Acquisition Corp. Warrant,$0.88,-0.1175,-11.779%,0.00,United States,2021,68150,Finance,Business Services
KALA,Kala Pharmaceuticals Inc. Common Stock,$7.66,-0.06,-0.777%,429418566.00,United States,2017,1530265,Health Care,Major Pharmaceuticals
KALU,Kaiser Aluminum Corporation Common Stock,$125.46,0.44,0.352%,1983794723.00,United States,,94075,Capital Goods,Metal Fabrications
KALV,KalVista Pharmaceuticals Inc. Common Stock,$32.50,1.51,4.873%,784011020.00,United Kingdom,2015,439135,Health Care,Major Pharmaceuticals
KBAL,Kimball International Inc. Class B Common Stock,$14.43,0.40,2.851%,532205990.00,United States,,134623,Consumer Durables,Home Furnishings
KBNT,Kubient Inc. Common Stock,$8.49,1.56,22.511%,99979505.00,United States,2020,1942242,Technology,EDP Services
KBNTW,Kubient Inc. Warrant,$3.60,0.4929,15.864%,0.00,United States,2020,23980,Technology,EDP Services
KBSF,KBS Fashion Group Limited Common Stock,$3.56,0.01,0.282%,9225024.00,China,2013,72732,Consumer Non-Durables,Apparel
KC,Kingsoft Cloud Holdings Limited American Depositary Shares,$52.48,-2.83,-5.117%,11441572360.00,China,2020,1386402,Technology,Computer Software: Prepackaged Software
KCAPL,KCAP Financial Inc. 6.125% Notes due 2022,$25.14,0.0428,0.171%,0.00,United States,,14072,,
KDMN,Kadmon Holdings Inc. Common Stock,$4.44,0.04,0.909%,762867236.00,United States,,3047900,Health Care,Major Pharmaceuticals
KDNY,Chinook Therapeutics Inc. Common Stock,$18.70,0.58,3.201%,788362678.00,United States,2015,182379,Health Care,Major Pharmaceuticals
KDP,Keurig Dr Pepper Inc. Common Stock,$33.37,0.07,0.21%,46960508867.00,United States,,5174996,Consumer Non-Durables,Beverages (Production/Distribution)
KE,Kimball Electronics Inc. Common Stock,$27.32,0.85,3.211%,681826907.00,United States,,131686,Technology,Electrical Products
KELYA,Kelly Services Inc. Class A Common Stock,$22.53,0.91,4.209%,885465071.00,United States,,272623,Technology,Professional Services
KELYB,Kelly Services Inc. Class B Common Stock,$22.05,0.70,3.279%,866600302.00,United States,,4217,Technology,Professional Services
KEQU,Kewaunee Scientific Corporation Common Stock,$12.46,0.02,0.161%,34424451.00,United States,,2602,Capital Goods,Medical Specialities
KERN,Akerna Corp. Common Stock,$5.80,-0.15,-2.521%,81540501.00,United States,2018,2316329,Technology,EDP Services
KERNW,Akerna Corp Warrant,$1.94,0.08,4.301%,0.00,United States,2018,10800,Technology,EDP Services
KFFB,Kentucky First Federal Bancorp Common Stock,$7.70,0.10,1.316%,63480456.00,United States,,3003,Finance,Savings Institutions
KFRC,Kforce Inc. Common Stock,$54.35,1.02,1.913%,1200430026.00,United States,1995,102733,Technology,Professional Services
KHC,The Kraft Heinz Company Common Stock,$38.11,-0.36,-0.936%,46615227718.00,United States,,8965853,Consumer Non-Durables,Packaged Foods
KIDS,OrthoPediatrics Corp. Common Stock,$46.09,1.10,2.445%,901272482.00,United States,2017,260821,Health Care,Medical/Dental Instruments
KIIIU,Kismet Acquisition Three Corp. Unit,$9.98,-0.02,-0.20%,0.00,United States,2021,43018,Finance,Business Services
KIN,Kindred Biosciences Inc. Common Stock,$4.90,0.04,0.823%,193511457.00,United States,2013,157786,Health Care,Major Pharmaceuticals
KINS,Kingstone Companies Inc. Common Stock,$7.31,-0.04,-0.544%,78035697.00,United States,,2989,Finance,Property-Casualty Insurers
KINZ,KINS Technology Group Inc. Class A Common Stock,$9.88,0.00,0.00%,340860000.00,United States,2021,535126,Finance,Business Services
KINZU,KINS Technology Group Inc. Unit,$10.43,0.09,0.87%,0.00,United States,2020,9806,Finance,Business Services
KINZW,KINS Technology Group Inc. Warrant,$1.03,0.02,1.98%,0.00,United States,2021,45499,Finance,Business Services
KIRK,Kirkland's Inc. COMMONSTOCK,$24.90,0.70,2.893%,354964340.00,United States,2002,1330223,Consumer Services,Other Specialty Stores
KLAC,KLA Corporation Common Stock,$294.27,-2.09,-0.705%,45339547550.00,United States,1980,1298393,Capital Goods,Electronic Components
KLAQ,KL Acquisition Corp Class A Common Stock,$9.77,0.02,0.205%,351109375.00,United States,2021,22176,Finance,Business Services
KLAQU,KL Acquisition Corp Unit,$10.06,0.02,0.199%,0.00,United States,2021,22952,Finance,Business Services
KLAQW,KL Acquisition Corp Warrant,$0.90,-0.04,-4.255%,0.00,United States,2021,70775,Finance,Business Services
KLDO,Kaleido Biosciences Inc. Common Stock,$10.03,-0.44,-4.202%,425941914.00,United States,2019,107046,Health Care,Biotechnology: Biological Products (No Diagnostic Substances)
KLIC,Kulicke and Soffa Industries Inc. Common Stock,$46.61,-0.23,-0.491%,2893408364.00,Singapore,,402963,Technology,Semiconductors
KLXE,KLX Energy Services Holdings Inc. Common Stock,$16.78,2.03,13.763%,142799780.00,United States,,125150,Energy,Oilfield Services/Equipment
KMDA,Kamada Ltd. Ordinary Shares,$6.20,-0.02,-0.322%,277421257.00,Israel,2013,43915,Health Care,Major Pharmaceuticals
KMPH,KemPharm Inc. Common Stock,$9.39,-0.59,-5.912%,177001340.00,United States,,4147240,Health Care,Major Pharmaceuticals
KNDI,Kandi Technologies Group Inc Common Stock,$7.06,-0.08,-1.12%,510985538.00,China,,2427077,Capital Goods,Auto Manufacturing
KNSA,Kiniksa Pharmaceuticals Ltd. Class A Common Stock,$23.22,-0.69,-2.886%,1584354099.00,United States,2018,511751,Health Care,Major Pharmaceuticals
KNSL,Kinsale Capital Group Inc. Common Stock,$173.71,-2.98,-1.687%,3955921107.00,United States,2016,157038,Finance,Property-Casualty Insurers
KNTE,Kinnate Biopharma Inc. Common Stock,$36.40,-0.46,-1.248%,1577110772.00,United States,2020,104489,Health Care,Major Pharmaceuticals
KOD,Kodiak Sciences Inc Common Stock,$126.99,-5.28,-3.992%,6497116224.00,United States,2018,259501,Health Care,Biotechnology: Biological Products (No Diagnostic Substances)
KOPN,Kopin Corporation Common Stock,$10.86,0.44,4.223%,988098935.00,United States,1992,4807770,Technology,Semiconductors
KOR,Corvus Gold Inc. Common Shares,$2.13,0.10,4.926%,269727960.00,Canada,,127223,Basic Industries,Precious Metals
KOSS,Koss Corporation Common Stock,$27.88,2.66,10.547%,234062999.00,United States,,16044621,Consumer Non-Durables,Consumer Electronics/Appliances
KPTI,Karyopharm Therapeutics Inc. Common Stock,$12.31,-0.20,-1.599%,918748122.00,United States,2013,1713030,Health Care,Major Pharmaceuticals
KRBP,Kiromic BioPharma Inc. Common Stock,$10.77,-0.43,-3.839%,78976399.00,United States,2020,16513,Health Care,Biotechnology: Biological Products (No Diagnostic Substances)
KRKR,36Kr Holdings Inc. American Depositary Shares,$4.06,0.32,8.556%,152227020.00,China,2019,219606,Miscellaneous,Business Services
KRMD,Repro Med Systems Inc. Common Stock,$3.89,0.00,0.00%,170937834.00,United States,,102380,Health Care,Medical/Dental Instruments
KRNLU,Kernel Group Holdings Inc. Units,$10.04,0.00,0.00%,0.00,United States,2021,27449,Finance,Business Services
KRNT,Kornit Digital Ltd. Ordinary Shares,$104.93,5.44,5.468%,4751012985.00,Israel,2015,423063,Capital Goods,Industrial Machinery/Components
KRNY,Kearny Financial Corp Common Stock,$13.20,0.19,1.46%,1111443445.00,United States,,242426,Finance,Savings Institutions
KRON,Kronos Bio Inc. Common Stock,$28.67,0.30,1.057%,1606480560.00,United States,2020,236169,Health Care,Major Pharmaceuticals
KROS,Keros Therapeutics Inc. Common Stock,$65.16,-0.89,-1.347%,1510301351.00,United States,2020,44988,Health Care,Major Pharmaceuticals
KRTX,Karuna Therapeutics Inc. Common Stock,$119.44,1.92,1.634%,3227117589.00,United States,2019,108004,Health Care,Major Pharmaceuticals
KRUS,Kura Sushi USA Inc. Class A Common Stock,$32.80,1.65,5.297%,274591301.00,United States,2019,46857,Consumer Services,Restaurants
KRYS,Krystal Biotech Inc. Common Stock,$82.81,-1.81,-2.139%,1837947413.00,United States,2017,99971,Health Care,Biotechnology: Biological Products (No Diagnostic Substances)
KSMT,Kismet Acquisition One Corp Ordinary Shares,$9.96,0.02,0.201%,316230000.00,Russia,2020,51532,Finance,Business Services
KSMTU,Kismet Acquisition One Corp Unit,$10.4055,0.0555,0.536%,0.00,Russia,2020,11369,Finance,Business Services
KSMTW,Kismet Acquisition One Corp Warrant,$0.96,0.0501,5.506%,0.00,Russia,,259848,Finance,Business Services
KSPN,Kaspien Holdings Inc. Common Stock,$46.00,3.26,7.628%,88604556.00,United States,,30544,Consumer Services,Consumer Electronics/Video Chains
KTCC,Key Tronic Corporation Common Stock,$8.72,0.18,2.108%,93824410.00,United States,1983,45932,Technology,Electrical Products
KTOS,Kratos Defense & Security Solutions Inc. Common Stock,$26.52,-0.43,-1.596%,3274241306.00,United States,,824447,Capital Goods,Military/Government/Technical
KTRA,Kintara Therapeutics Inc. Common Stock,$2.15,0.05,2.381%,65845939.00,United States,,435592,Health Care,Major Pharmaceuticals
KURA,Kura Oncology Inc. Common Stock,$29.50,-0.03,-0.102%,1953230843.00,United States,,392006,Health Care,Major Pharmaceuticals
KURIU,Alkuri Global Acquisition Corp. Unit,$9.99,0.00,0.00%,0.00,United States,2021,437012,Finance,Business Services
KVHI,KVH Industries Inc. Common Stock,$13.39,-0.22,-1.616%,246775558.00,United States,1996,43318,Technology,Radio And Television Broadcasting And Communications Equipment
KVSA,Khosla Ventures Acquisition Co. Class A Common Stock,$10.43,-0.02,-0.191%,374437000.00,United States,2021,367891,Finance,Business Services
KXIN,Kaixin Auto Holdings Ordinary Share,$3.33,-0.04,-1.187%,216890056.00,China,2017,1583075,Consumer Durables,Automotive Aftermarket
KYMR,Kymera Therapeutics Inc. Common Stock,$56.10,-3.19,-5.38%,2494146590.00,United States,2020,875438,Health Care,Biotechnology: Biological Products (No Diagnostic Substances)
KZIA,Kazia Therapeutics Limited American Depositary Shares,$10.98,0.54,5.172%,138960420.00,Australia,,153672,Health Care,Major Pharmaceuticals
KZR,Kezar Life Sciences Inc. Common Stock,$6.80,0.24,3.659%,315520000.00,United States,2018,180412,Health Care,Major Pharmaceuticals
LABP,Landos Biopharma Inc. Common Stock,$13.44,0.12,0.901%,526353059.00,United States,2021,57824,Health Care,Major Pharmaceuticals
LACQ,Leisure Acquisition Corp. Common Stock,$14.12,-0.06,-0.423%,87886664.00,United States,2017,1452,Finance,Business Services
LACQW,Leisure Acquisition Corp. Warrant,$1.22,0.0201,1.675%,0.00,United States,2017,18829,Finance,Business Services
LAKE,Lakeland Industries Inc. Common Stock,$30.16,-0.44,-1.438%,241882597.00,United States,1986,151999,Health Care,Industrial Specialties
LAMR,Lamar Advertising Company Class A Common Stock,$95.66,1.36,1.442%,9653216187.00,United States,1996,748864,Consumer Services,Real Estate Investment Trusts
LANC,Lancaster Colony Corporation Common Stock,$185.49,1.58,0.859%,5110064010.00,United States,,80912,Consumer Non-Durables,Packaged Foods
LAND,Gladstone Land Corporation Common Stock,$19.31,-0.11,-0.566%,516410555.00,United States,2013,218614,Consumer Services,Real Estate Investment Trusts
LANDM,Gladstone Land Corporation 5.00% Series D Cumulative Term Preferred Stock,$25.69,-0.07,-0.272%,619190810.00,United States,,8724,Consumer Services,Real Estate Investment Trusts
LANDO,Gladstone Land Corporation 6.00% Series B Cumulative Redeemable Preferred Stock,$25.62,-0.03,-0.117%,0.00,United States,,15050,Consumer Services,Real Estate Investment Trusts
LARK,Landmark Bancorp Inc. Common Stock,$27.74,-0.35,-1.246%,131788246.00,United States,,4625,Finance,Major Banks
LASR,nLIGHT Inc. Common Stock,$35.01,-0.74,-2.07%,1482328862.00,United States,2018,211088,Technology,Semiconductors
LATN,Union Acquisition Corp. II Ordinary Shares,$10.05,0.00,0.00%,251250000.00,United States,2019,22522,Finance,Business Services
LATNU,Union Acquisition Corp. II Units containing one ordinary share and one redeemable warrant,$10.75,0.00,0.00%,0.00,United States,2019,100,Finance,Business Services
LATNW,Union Acquisition Corp. II Warrant,$0.9499,0.0499,5.544%,0.00,United States,2019,109062,Finance,Business Services
LAUR,Laureate Education Inc. Class A Common Stock,$14.56,0.21,1.463%,2896861677.00,United States,2017,432672,Consumer Services,Other Consumer Services
LAWS,Lawson Products Inc. Common Stock,$60.08,1.19,2.021%,544387223.00,United States,,9735,Consumer Durables,Industrial Specialties
LAZR,Luminar Technologies Inc.  Class A Common Stock,$27.46,1.17,4.45%,8895289150.00,United States,2019,5105699,Capital Goods,Auto Parts:O.E.M.
LAZY,Lazydays Holdings Inc. Common Stock,$21.50,0.01,0.047%,203214797.00,United States,,129784,Consumer Durables,Automotive Aftermarket
LBAI,Lakeland Bancorp Inc. Common Stock,$18.37,0.30,1.66%,927703719.00,United States,,147360,Finance,Major Banks
LBC,Luther Burbank Corporation Common Stock,$12.12,0.10,0.832%,632909624.00,United States,2017,21302,Finance,Major Banks
LBPH,Longboard Pharmaceuticals Inc. Common Stock,$16.65,0.65,4.063%,,United States,,1967893,,
LBRDA,Liberty Broadband Corporation Class A Common Stock,$148.94,0.22,0.148%,29090777753.00,United States,,126032,Consumer Services,Television Services
LBRDK,Liberty Broadband Corporation Class C Common Stock,$153.41,1.16,0.762%,29963852659.00,United States,,1206995,Consumer Services,Television Services
LBRDP,Liberty Broadband Corporation Series A Cumulative Redeemable Preferred Stock,$26.75,0.0002,0.001%,0.00,United States,,44282,Public Utilities,Telecommunications Equipment
LBTYA,Liberty Global plc Class A Ordinary Shares,$25.70,0.09,0.351%,14839501713.00,United Kingdom,,665216,,
LBTYB,Liberty Global plc Class B Ordinary Shares,$25.6156,1.4656,6.069%,14790768096.00,United Kingdom,,2053,Consumer Services,Television Services
LBTYK,Liberty Global plc Class C Ordinary Shares,$25.43,0.16,0.633%,14683600333.00,United Kingdom,,3026674,,
LCAAU,L Catterton Asia Acquisition Corp Units,$10.05,-0.01,-0.099%,0.00,Singapore,2021,281300,,
LCAP,Lionheart Acquisition Corp. II Class A Common Stock,$9.86,-0.06,-0.605%,289884000.00,United States,2020,81042,Finance,Business Services
LCAPU,Lionheart Acquisition Corp. II Unit,$10.32,-0.0606,-0.584%,0.00,United States,2020,103464,Finance,Business Services
LCAPW,Lionheart Acquisition Corp. II Warrant,$1.12,-0.03,-2.609%,0.00,United States,2020,20659,Finance,Business Services
LCNB,LCNB Corporation Common Stock,$19.96,0.53,2.728%,256652167.00,United States,,59003,Finance,Major Banks
LCUT,Lifetime Brands Inc. Common Stock,$14.92,0.10,0.675%,324778858.00,United States,1991,26222,Capital Goods,Industrial Machinery/Components
LCY,Landcadia Holdings III Inc. Class A Common Stock,$10.31,-0.13,-1.245%,634065000.00,United States,2020,942963,Technology,Computer Software: Prepackaged Software
LCYAU,Landcadia Holdings III Inc. Unit ,$10.8859,-0.0741,-0.676%,0.00,United States,2020,328684,Capital Goods,Industrial Machinery/Components
LCYAW,Landcadia Holdings III Inc. Warrant,$1.58,-0.10,-5.952%,0.00,United States,2020,648194,Capital Goods,Industrial Machinery/Components
LE,Lands' End Inc. Common Stock,$35.49,-0.30,-0.838%,1157249296.00,United States,,107659,Consumer Services,Clothing/Shoe/Accessory Stores
LECO,Lincoln Electric Holdings Inc. Common Shares,$123.54,1.16,0.948%,7370647927.00,United States,,174346,Technology,Industrial Machinery/Components
LEDS,SemiLEDS Corporation Common Stock,$5.08,0.17,3.462%,20377521.00,Taiwan,2010,75629,Technology,Semiconductors
LEGH,Legacy Housing Corporation Common Stock (TX),$16.60,0.11,0.667%,401589806.00,United States,2018,19392,Basic Industries,Homebuilding
LEGN,Legend Biotech Corporation American Depositary Shares,$25.33,0.29,1.158%,3273713867.00,United States,2020,440357,Health Care,Major Pharmaceuticals
LEGO,Legato Merger Corp. Common stock,$9.76,0.01,0.103%,259889631.00,United States,2021,410495,Finance,Business Services
LEGOU,Legato Merger Corp. Units,$10.37,-0.01,-0.096%,0.00,United States,2021,200593,Finance,Business Services
LEGOW,Legato Merger Corp. Warrant,$0.67,0.00,0.00%,0.00,United States,2021,584549,Finance,Business Services
LESL,Leslie's Inc. Common Stock,$23.73,-0.53,-2.185%,4434504382.00,United States,2020,1647916,Consumer Services,Other Specialty Stores
LEVL,Level One Bancorp Inc. Common Stock,$24.15,-0.35,-1.429%,184355787.00,United States,2018,16209,Finance,Major Banks
LEVLP,Level One Bancorp Inc. Depositary Shares Each Representing a 1/100th Interest in a Share of 7.50% Non-Cumulative Perpetual Preferred Stock Series B,$26.99,0.8117,3.101%,0.00,United States,,2125,Finance,Major Banks
LEXX,Lexaria Bioscience Corp. Common Stock,$6.36,0.05,0.792%,32463552.00,Canada,,72549,Health Care,Major Pharmaceuticals
LEXXW,Lexaria Bioscience Corp. Warrant,$2.10,-0.0899,-4.105%,0.00,Canada,,33362,Health Care,Major Pharmaceuticals
LFMD,LifeMD Inc. Common Stock,$18.14,0.20,1.115%,464004928.00,United States,,498776,Health Care,Medical/Nursing Services
LFTR,Lefteris Acquisition Corp. Class A Common Stock,$10.16,-0.02,-0.196%,263015659.00,United States,2020,142821,Finance,Business Services
LFTRU,Lefteris Acquisition Corp. Unit,$10.85,0.05,0.463%,0.00,United States,2020,429,Finance,Business Services
LFTRW,Lefteris Acquisition Corp. Warrant,$1.90,-0.07,-3.553%,0.00,United States,2020,26921,Finance,Business Services
LFUS,Littelfuse Inc. Common Stock,$268.74,1.46,0.546%,6594184907.00,United States,,78576,Consumer Durables,Electrical Products
LFVN,Lifevantage Corporation Common Stock (Delaware),$9.36,0.08,0.862%,132599226.00,United States,,82495,Health Care,Major Pharmaceuticals
LGACU,Lazard Growth Acquisition Corp. I Units,$10.11,-0.04,-0.394%,0.00,,2021,152823,Finance,Business Services
LGHL,Lion Group Holding Ltd. American Depositary Share,$3.80,0.50,15.152%,73988466.00,China,,6181849,Finance,Investment Bankers/Brokers/Service
LGHLW,Lion Group Holding Ltd. Warrant,$0.53,0.0405,8.274%,0.00,China,,525113,Finance,Investment Bankers/Brokers/Service
LGIH,LGI Homes Inc. Common Stock,$138.59,0.18,0.13%,3462471719.00,United States,2013,280605,Capital Goods,Homebuilding
LGND,Ligand Pharmaceuticals Incorporated Common Stock,$164.78,8.04,5.13%,2737394897.00,United States,,312861,Health Care,Major Pharmaceuticals
LGVN,Longeveron Inc. Class A Common Stock,$8.12,-0.33,-3.905%,151900117.00,United States,2021,1382514,Health Care,Major Pharmaceuticals
LHAA,Lerer Hippeau Acquisition Corp. Class A Common Stock,$10.00,0.04,0.402%,256400000.00,United States,2021,155546,Finance,Business Services
LHCG,LHC Group Common Stock,$195.00,4.06,2.126%,6160894935.00,United States,2005,240105,Health Care,Medical/Nursing Services
LHDX,Lucira Health Inc. Common Stock,$15.19,-0.43,-2.753%,581970946.00,United States,2021,218409,Health Care,Biotechnology: In Vitro & In Vivo Diagnostic Substances
LI,Li Auto Inc. American Depositary Shares,$25.69,-0.33,-1.268%,23059193842.00,China,2020,11678123,Capital Goods,Auto Manufacturing
LIFE,aTyr Pharma Inc. Common Stock,$4.92,0.13,2.714%,50112453.00,United States,2015,1430416,Health Care,Biotechnology: Biological Products (No Diagnostic Substances)
LILA,Liberty Latin America Ltd. Class A Common Stock,$14.48,0.66,4.776%,3360408381.00,United States,,266487,Consumer Services,Television Services
LILAK,Liberty Latin America Ltd. Class C Common Stock,$14.55,0.67,4.827%,3376653449.00,United States,,789064,Consumer Services,Television Services
LINC,Lincoln Educational Services Corporation Common Stock,$6.47,0.00,0.00%,174618604.00,United States,2005,189712,Consumer Services,Other Consumer Services
LIND,Lindblad Expeditions Holdings Inc. Common Stock,$20.76,0.54,2.671%,1037766035.00,United States,2013,289618,Consumer Services,Transportation Services
LIQT,LiqTech International Inc. Common Stock,$10.41,0.08,0.774%,225433349.00,Denmark,,55428,Technology,Industrial Machinery/Components
LITE,Lumentum Holdings Inc. Common Stock,$88.72,2.06,2.377%,6716104000.00,United States,,1499381,Capital Goods,Telecommunications Equipment
LIVE,Live Ventures Incorporated Common Stock,$26.44,0.96,3.768%,41118827.00,United States,,9066,Consumer Services,Other Specialty Stores
LIVK,LIV Capital Acquisition Corp. Class A Ordinary Shares,$10.00,-0.0342,-0.341%,101325000.00,Mexico,2020,118,Finance,Business Services
LIVKW,LIV Capital Acquisition Corp. Warrant,$0.88,0.00,0.00%,0.00,Mexico,2020,3800,Finance,Business Services
LIVN,LivaNova PLC Ordinary Shares,$78.01,0.01,0.013%,3796234096.00,United Kingdom,,212108,Health Care,Biotechnology: Electromedical & Electrotherapeutic Apparatus
LIVX,LiveXLive Media Inc. Common Stock,$4.16,-0.03,-0.716%,313990880.00,United States,,378182,Consumer Services,Restaurants
LIXT,Lixte Biotechnology Holdings Inc. Common Stock,$4.37,0.54,14.099%,59027355.00,United States,,1448316,Health Care,Major Pharmaceuticals
LIXTW,Lixte Biotechnology Holdings Inc. Warrants,$1.04,0.23,28.395%,0.00,United States,,73927,Health Care,Major Pharmaceuticals
LIZI,LIZHI INC. American Depositary Shares,$10.63,0.10,0.95%,490413838.00,China,2020,3146461,Technology,Computer Software: Programming Data Processing
LJAQ,LightJump Acquisition Corporation Common Stock,$9.73,-0.05,-0.511%,0.00,United States,2021,56718,Finance,Business Services
LJAQU,LightJump Acquisition Corporation Unit,$10.10,0.00,0.00%,0.00,United States,2021,5425,Finance,Business Services
LJAQW,LightJump Acquisition Corporation Warrant,$0.893,0.068,8.242%,0.00,United States,2021,63067,Finance,Business Services
LJPC,La Jolla Pharmaceutical Company Common Stock,$5.69,0.25,4.596%,156067636.00,United States,1994,306687,Health Care,Biotechnology: Biological Products (No Diagnostic Substances)
LKCO,Luokung Technology Corp Ordinary Shares,$1.06,-0.04,-3.636%,336917572.00,China,,12744560,Technology,EDP Services
LKFN,Lakeland Financial Corporation Common Stock,$76.25,0.75,0.993%,1964283799.00,United States,,100581,Finance,Major Banks
LKQ,LKQ Corporation Common Stock,$42.985,0.405,0.951%,13037885190.00,United States,,1533429,Consumer Services,Motor Vehicles
LLIT,Lianluo Smart Limited Class A Common Stock,$9.41,0.14,1.51%,4233992.00,China,,1389832,Consumer Services,Other Specialty Stores
LLNW,Limelight Networks Inc. Common Stock,$3.44,0.08,2.381%,427024448.00,United States,2007,2920043,Miscellaneous,Business Services
LMACU,Liberty Media Acquisition Corporation Unit,$11.70,0.11,0.949%,0.00,United States,2021,170338,Finance,Business Services
LMAOU,LMF Acquisition Opportunities Inc. Unit,$10.22,0.0255,0.25%,0.00,United States,2021,4152,Finance,Business Services
LMAT,LeMaitre Vascular Inc. Common Stock,$48.10,0.66,1.391%,978449479.00,United States,2006,108371,Health Care,Medical/Dental Instruments
LMB,Limbach Holdings Inc. Common Stock,$12.39,-0.10,-0.801%,123253477.00,United States,,102388,Basic Industries,Engineering & Construction
LMFA,LM Funding America Inc. Common Stock,$1.51,-0.03,-1.948%,40050936.00,United States,2015,692180,Finance,Finance: Consumer Services
LMNL,Liminal BioSciences Inc. Common Shares,$4.65,0.11,2.423%,136644644.00,Canada,,166108,Health Care,Major Pharmaceuticals
LMNR,Limoneira Co Common Stock,$19.01,0.68,3.71%,336471620.00,United States,,49992,Consumer Non-Durables,Farming/Seeds/Milling
LMNX,Luminex Corporation Common Stock,$32.76,0.31,0.955%,1529509003.00,United States,2000,357337,Health Care,Medical/Dental Instruments
LMPX,LMP Automotive Holdings Inc. Common Stock,$19.00,-0.28,-1.452%,188165607.00,United States,2019,50402,Consumer Durables,Automotive Aftermarket
LMRK,Landmark Infrastructure Partners LP Common Units,$12.71,0.18,1.437%,323965088.00,United States,2014,20137,Consumer Services,Real Estate
LMRKN,Landmark Infrastructure Partners LP 7% Series C Fltg/Fxd Perpetual Conv Preferred Stock,$25.97,-0.1881,-0.719%,0.00,United States,,3950,Consumer Services,Real Estate
