Symbol,Name,Last Sale,Net Change,% Change,Market Cap,Country,IPO Year,Volume,Sector,Industry
PYPD,PolyPid Ltd. Ordinary Shares,$10.50,0.01,0.095%,196823991.00,Israel,2020,83419,Health Care,Medical/Dental Instruments
PYPL,PayPal Holdings Inc. Common Stock,$250.35,-3.48,-1.371%,293203851516.00,United States,,7605594,Miscellaneous,Business Services
PYR,PyroGenesis Canada Inc. Common Shares,$8.69,0.35,4.197%,,Canada,,600285,,
PZZA,Papa John's International Inc. Common Stock,$87.16,-0.45,-0.514%,2870014329.00,United States,1993,415873,Consumer Services,Restaurants
QADA,QAD Inc. Class A Common Stock,$71.02,-2.52,-3.427%,1470048449.00,United States,,41475,Technology,Computer Software: Prepackaged Software
QADB,QAD Inc. Class B Common Stock,$48.87,-2.33,-4.551%,1011563893.00,United States,,301,Technology,Computer Software: Prepackaged Software
QCOM,QUALCOMM Incorporated Common Stock,$129.98,-1.76,-1.336%,147657280000.00,United States,1991,9359853,Technology,Radio And Television Broadcasting And Communications Equipment
QCRH,QCR Holdings Inc. Common Stock,$47.98,-0.03,-0.062%,757765269.00,United States,,75299,Finance,Major Banks
QDEL,Quidel Corporation Common Stock,$136.19,1.86,1.385%,5763440272.00,United States,,912596,Health Care,Biotechnology: In Vitro & In Vivo Diagnostic Substances
QELL,Qell Acquisition Corp. Class A Ordinary Shares,$10.51,-0.08,-0.755%,498568125.00,United States,2020,587916,Finance,Business Services
QELLU,Qell Acquisition Corp. Unit,$11.45,0.06,0.527%,0.00,United States,2020,8560,Finance,Business Services
QELLW,Qell Acquisition Corp. Warrant,$2.7801,0.2301,9.024%,0.00,United States,2020,255278,Finance,Business Services
QFIN,360 DigiTech Inc. American Depositary Shares,$31.49,0.33,1.059%,4789992647.00,China,2018,4309554,Finance,Finance: Consumer Services
QH,Quhuo Limited American Depository Shares,$6.73,0.15,2.28%,349330139.00,China,2020,65173,Miscellaneous,Business Services
QIWI,QIWI plc American Depositary Shares,$11.17,0.17,1.545%,700503931.00,Cyprus,2013,819207,Miscellaneous,Business Services
QK,Q&K International Group Limited American Depositary Shares,$3.02,0.08,2.721%,163718220.00,China,2019,140216,Finance,Real Estate
QLGN,Qualigen Therapeutics Inc. Common Stock,$3.33,0.03,0.909%,88934473.00,United States,2015,548999,Health Care,Major Pharmaceuticals
QLI,Qilian International Holding Group Ltd. Ordinary Shares,$4.98,-0.15,-2.924%,178035000.00,China,2021,70958,Health Care,Major Pharmaceuticals
QLYS,Qualys Inc. Common Stock,$100.53,-0.19,-0.189%,3941553600.00,United States,2012,381239,Technology,Computer Software: Prepackaged Software
QMCO,Quantum Corporation Common Stock,$9.06,0.11,1.229%,513368655.00,United States,,265600,Technology,Electronic Components
QNST,QuinStreet Inc. Common Stock,$23.41,-0.56,-2.336%,1247671088.00,United States,2010,177138,Miscellaneous,Business Services
QQQX,Nuveen NASDAQ 100 Dynamic Overwrite Fund Shares of Beneficial Interest,$26.99,0.0285,0.106%,1120298275.00,United States,,57945,,
QRHC,Quest Resource Holding Corporation Common Stock,$3.50,0.37,11.821%,64334295.00,United States,,745491,Technology,Diversified Commercial Services
QRTEA,Qurate Retail Inc. Series A Common Stock ,$13.03,-0.175,-1.325%,5347677937.00,United States,,3185668,Consumer Services,Catalog/Specialty Distribution
QRTEB,Qurate Retail Inc. Series B Common Stock ,$12.90,-0.26,-1.976%,5282827208.00,United States,,933,Consumer Services,Catalog/Specialty Distribution
QRTEP,Qurate Retail Inc. 8.0% Fixed Rate Cumulative Redeemable Preferred Stock,$101.03,0.33,0.328%,0.00,United States,,34894,Consumer Services,Catalog/Specialty Distribution
QRVO,Qorvo Inc. Common Stock,$172.59,-2.36,-1.349%,19548010601.00,United States,,802662,Technology,Semiconductors
QTNT,Quotient Limited Ordinary Shares,$4.20,-0.07,-1.639%,424759663.00,Switzerland,2014,586513,Health Care,Biotechnology: In Vitro & In Vivo Diagnostic Substances
QTRX,Quanterix Corporation Common Stock,$60.98,-2.67,-4.195%,2211598797.00,United States,2017,427472,Capital Goods,Biotechnology: Laboratory Analytical Instruments
QTT,Qutoutiao Inc. American Depositary Shares,$3.10,0.14,4.73%,827160761.00,China,2018,4884648,Technology,Computer Software: Programming Data Processing
QUIK,QuickLogic Corporation Common Stock,$7.94,-0.19,-2.337%,87883723.00,United States,1999,117763,Technology,Semiconductors
QUMU,Qumu Corporation Common Stock,$8.19,-0.07,-0.847%,143979619.00,United States,,44364,Technology,Computer Software: Prepackaged Software
QURE,uniQure N.V. Ordinary Shares,$33.96,-0.51,-1.48%,1527995799.00,Netherlands,2014,329494,Health Care,Major Pharmaceuticals
RAAC,Revolution Acceleration Acquisition Corp Class A Common Stock,$10.97,0.04,0.366%,420516663.00,United States,2021,460084,Finance,Business Services
RAACU,Revolution Acceleration Acquisition Corp Unit,$11.68,0.01,0.086%,0.00,United States,2020,15540,Finance,Business Services
RAACW,Revolution Acceleration Acquisition Corp Warrant,$2.08,-0.03,-1.422%,0.00,United States,2021,111990,Finance,Business Services
RACA,Therapeutics Acquisition Corp. Class A Common Stock,$13.36,-0.32,-2.339%,232916904.00,United States,2020,11775,Finance,Business Services
RADA,RADA Electronic Industries Ltd. Ordinary Shares,$12.95,-0.06,-0.461%,563131592.00,Israel,,265259,Technology,Electronic Components
RADI,Radius Global Infrastructure Inc. Class A Common Stock,$11.78,-0.02,-0.169%,717395179.00,United States,,52129,Consumer Services,Real Estate
RAIL,FreightCar America Inc. Common Stock,$3.44,0.04,1.176%,53439812.00,United States,2005,165869,Capital Goods,Railroads
RAND,Rand Capital Corporation Common Stock,$15.33,0.0074,0.048%,39584651.00,United States,,4521,Finance,Finance: Consumer Services
RAPT,RAPT Therapeutics Inc. Common Stock,$22.29,-0.24,-1.065%,547336723.00,United States,2019,292830,Health Care,Major Pharmaceuticals
RARE,Ultragenyx Pharmaceutical Inc. Common Stock,$126.95,0.10,0.079%,8499206526.00,United States,2014,199490,Health Care,Major Pharmaceuticals
RAVE,Rave Restaurant Group Inc. Common Stock,$1.57,0.16,11.348%,28267699.00,United States,,1224072,Consumer Non-Durables,Food Distributors
RAVN,Raven Industries Inc. Common Stock,$41.98,-0.48,-1.13%,1505141894.00,United States,,197919,Capital Goods,Specialty Chemicals
RBB,RBB Bancorp Common Stock,$22.90,0.41,1.823%,448059591.00,United States,2017,37401,Finance,Major Banks
RBBN,Ribbon Communications Inc. Common Stock,$8.37,0.17,2.073%,1218311579.00,United States,,551058,Technology,EDP Services
RBCAA,Republic Bancorp Inc. Class A Common Stock,$46.86,0.885,1.925%,977697255.00,United States,1998,31013,Finance,Major Banks
RBCN,Rubicon Technology Inc. Common Stock,$10.34,-0.21,-1.991%,25041639.00,United States,2007,1079,Technology,Semiconductors
RBKB,Rhinebeck Bancorp Inc. Common Stock,$10.53,-0.07,-0.66%,117233544.00,United States,2019,745,Finance,Banks
RBNC,Reliant Bancorp Inc. Common Stock,$26.99,0.99,3.808%,442310528.00,United States,,165468,Finance,Major Banks
RCEL,Avita Therapeutics Inc. Common Stock,$22.48,0.02,0.089%,486211670.00,Australia,,118628,Health Care,Medical/Dental Instruments
RCHG,Recharge Acquisition Corp. Class A Common Stock,$9.97,-0.03,-0.30%,256727500.00,United States,2020,142717,Finance,Business Services
RCHGU,Recharge Acquisition Corp. Unit,$10.45,0.00,0.00%,0.00,United States,2020,4537,Finance,Business Services
RCHGW,Recharge Acquisition Corp. Warrant,$1.13,0.05,4.63%,0.00,United States,2020,35321,Finance,Business Services
RCII,Rent-A-Center Inc. Common Stock,$63.92,1.95,3.147%,3478124791.00,United States,1995,720171,Technology,Diversified Commercial Services
RCKT,Rocket Pharmaceuticals Inc. Common Stock,$53.62,-1.62,-2.933%,3312551320.00,United States,2015,316465,Health Care,Major Pharmaceuticals
RCKY,Rocky Brands Inc. Common Stock,$48.67,0.52,1.08%,352742201.00,United States,1993,35584,Consumer Non-Durables,Shoe Manufacturing
RCLFU,Rosecliff Acquisition Corp I Unit,$10.00,-0.01,-0.10%,0.00,United States,2021,191184,Finance,Business Services
RCM,R1 RCM Inc. Common Stock,$27.43,-0.42,-1.508%,7161046332.00,United States,,1353428,Consumer Services,Other Consumer Services
RCMT,RCM Technologies Inc. Common Stock,$4.03,-0.11,-2.657%,48174338.00,United States,,251896,Technology,Professional Services
RCON,Recon Technology Ltd. Ordinary Shares,$3.07,0.09,3.02%,22112694.00,China,2009,363871,Energy,Oilfield Services/Equipment
RDCM,Radcom Ltd. Ordinary Shares,$9.60,0.01,0.104%,133859098.00,Israel,1997,40187,Technology,Computer peripheral equipment
RDFN,Redfin Corporation Common Stock,$74.61,-2.08,-2.712%,7700232041.00,United States,2017,1231479,Finance,Real Estate
RDHL,Redhill Biopharma Ltd. American Depositary Shares,$7.90,-0.12,-1.496%,3665197495.00,Israel,,208670,Health Care,Major Pharmaceuticals
RDI,Reading International Inc Class A Common Stock,$7.10,-0.45,-5.96%,154419299.00,United States,,114889,Consumer Services,Movies/Entertainment
RDIB,Reading International Inc Class B Common Stock,$22.20,0.00,0.00%,482832173.00,United States,,3,Consumer Services,Movies/Entertainment
RDNT,RadNet Inc. Common Stock,$23.87,0.31,1.316%,1232647850.00,United States,,241756,Health Care,Medical Specialities
RDUS,Radius Health Inc. Common Stock,$22.90,0.16,0.704%,1073882424.00,United States,2014,321877,Health Care,Major Pharmaceuticals
RDVT,Red Violet Inc. Common Stock ,$18.74,0.39,2.125%,227691656.00,United States,,62783,Technology,Computer Software: Prepackaged Software
RDWR,Radware Ltd. Ordinary Shares,$26.56,-0.23,-0.859%,1226014328.00,Israel,1999,205254,Miscellaneous,Business Services
REAL,The RealReal Inc. Common Stock,$23.22,0.19,0.825%,2085973808.00,United States,2019,1711067,Consumer Services,Other Specialty Stores
REDU,RISE Education Cayman Ltd American Depositary Shares,$6.00,0.05,0.84%,338268966.00,China,2017,11071,Consumer Services,Other Consumer Services
REED,Reeds Inc. Common Stock,$1.04,-0.05,-4.587%,86841660.00,United States,,1186237,Consumer Non-Durables,Beverages (Production/Distribution)
REFR,Research Frontiers Incorporated Common Stock,$3.58,-0.32,-8.205%,113041314.00,United States,,226983,Miscellaneous,Multi-Sector Companies
REG,Regency Centers Corporation Common Stock,$59.15,0.765,1.31%,10045382570.00,United States,1993,1014467,Consumer Services,Real Estate Investment Trusts
REGI,Renewable Energy Group Inc. Common Stock,$80.55,-2.17,-2.623%,3168421281.00,United States,2012,847239,Basic Industries,Major Chemicals
REGN,Regeneron Pharmaceuticals Inc. Common Stock,$471.46,1.50,0.319%,50508405103.00,United States,1991,552728,Health Care,Major Pharmaceuticals
REKR,Rekor Systems Inc. Common Stock,$17.29,-0.58,-3.246%,702722173.00,United States,,544940,Capital Goods,Telecommunications Equipment
RELI,Reliance Global Group Inc. Common Stock,$4.39,-0.02,-0.454%,18271685.00,United States,,72381,Finance,Specialty Insurers
RELIW,Reliance Global Group Inc. Series A Warrants,$1.20,0.0201,1.704%,0.00,United States,,13554,Finance,Specialty Insurers
RELL,Richardson Electronics Ltd. Common Stock,$6.75,-0.02,-0.295%,89151665.00,United States,1983,37510,Technology,Electronic Components
REPH,Recro Pharma Inc. Common Stock,$3.74,-0.04,-1.058%,124221942.00,United States,2014,218524,Health Care,Major Pharmaceuticals
REPL,Replimune Group Inc. Common Stock,$33.99,-0.155,-0.454%,1580312943.00,United States,2018,194573,Health Care,Biotechnology: Biological Products (No Diagnostic Substances)
RESN,Resonant Inc. Common Stock,$4.92,-0.15,-2.959%,266546742.00,United States,2014,1249343,Technology,Semiconductors
RETA,Reata Pharmaceuticals Inc. Class A Common Stock,$132.81,2.96,2.28%,4807844849.00,United States,2016,194351,Health Care,Major Pharmaceuticals
RETO,ReTo Eco-Solutions Inc. Common Shares,$1.91,0.17,9.77%,46097850.00,China,2017,613440,Capital Goods,Industrial Machinery/Components
REYN,Reynolds Consumer Products Inc. Common Stock,$29.98,0.41,1.387%,6286820990.00,United States,2020,525895,Consumer Durables,Containers/Packaging
RFIL,RF Industries Ltd. Common Stock,$5.99,-0.14,-2.284%,58990994.00,United States,,40604,Capital Goods,Electrical Products
RGCO,RGC Resources Inc. Common Stock,$23.73,-0.17,-0.711%,194952367.00,United States,,15254,Public Utilities,Oil & Gas Production
RGEN,Repligen Corporation Common Stock,$194.70,0.62,0.319%,10663980482.00,United States,1986,344880,Health Care,Biotechnology: Biological Products (No Diagnostic Substances)
RGLD,Royal Gold Inc. Common Stock,$109.53,0.39,0.357%,7185879507.00,United States,,333867,Basic Industries,Precious Metals
RGLS,Regulus Therapeutics Inc. Common Stock,$1.96,0.29,17.365%,142109353.00,United States,2012,70508249,Health Care,Major Pharmaceuticals
RGNX,REGENXBIO Inc. Common Stock,$40.77,-0.82,-1.972%,1732663152.00,United States,2015,199434,Health Care,Biotechnology: Biological Products (No Diagnostic Substances)
RGP,Resources Connection Inc. Common Stock,$14.47,0.19,1.331%,470395173.00,United States,,171680,Miscellaneous,Business Services
RIBT,RiceBran Technologies Common Stock,$1.04,0.02,1.961%,47047610.00,United States,,266803,Consumer Non-Durables,Packaged Foods
RICK,RCI Hospitality Holdings Inc. Common Stock,$70.86,1.26,1.81%,637733623.00,United States,1995,70657,Consumer Services,Restaurants
RIDE,Lordstown Motors Corp. Class A Common Stock,$14.78,-2.93,-16.544%,2437945082.00,United States,2019,50554650,Capital Goods,Auto Manufacturing
RIGL,Rigel Pharmaceuticals Inc. Common Stock,$4.23,0.00,0.00%,719277017.00,United States,2000,1895639,Health Care,Major Pharmaceuticals
RILY,B. Riley Financial Inc. Common Stock,$59.00,-0.20,-0.338%,1604274428.00,United States,,165018,Miscellaneous,Business Services
RILYG,B. Riley Financial Inc. 7.25% Senior Notes due 2027,$25.43,-0.04,-0.157%,0.00,United States,,6426,Miscellaneous,Business Services
RILYH,B. Riley Financial Inc. 7.375% Senior Notes due 2023,$25.8803,-0.0197,-0.076%,0.00,United States,,502,Miscellaneous,Business Services
RILYI,B. Riley Financial Inc. 6.875% Senior Notes due 2023,$25.675,-0.075,-0.291%,0.00,United States,,188,Miscellaneous,Business Services
RILYL,B. Riley Financial Inc. Depositary Shares each representing 1/1000th in a share of 7.375% Series B Cumulative Perpetual Preferred Stock par value $0.0001,$27.05,-0.15,-0.551%,0.00,United States,,5526,Miscellaneous,Business Services
RILYM,B. Riley Financial Inc. 6.375% Senior Notes due 2025,$25.64,-0.13,-0.504%,0.00,United States,,1062,Miscellaneous,Business Services
RILYN,B. Riley Financial Inc. 6.50% Senior Notes Due 2026,$25.60,-0.07,-0.273%,0.00,United States,,80706,Miscellaneous,Business Services
RILYO,B. Riley Financial Inc. 6.75% Senior Notes due 2024,$25.85,-0.26,-0.996%,0.00,United States,,2295,Miscellaneous,Business Services
RILYP,B. Riley Financial Inc. Depositary Shares each representing a 1/1000th fractional interest in a share of Series A Cumulative Perpetual Preferred Stock,$26.95,-0.0255,-0.095%,0.00,United States,,987,Miscellaneous,Business Services
RILYT,B. Riley Financial Inc. 6.00% Senior Notes Due 2028,$25.46,-0.01,-0.039%,0.00,United States,,35191,Miscellaneous,Business Services
RILYZ,B. Riley Financial Inc. 7.50% Senior Notes Due 2027,$25.283,0.003,0.012%,0.00,United States,,23753,Miscellaneous,Business Services
RIOT,Riot Blockchain Inc.  Common Stock ,$62.81,-0.50,-0.79%,4241553459.00,United States,,26732594,Technology,EDP Services
RIVE,Riverview Financial Corporation Common Stock,$10.05,0.23,2.342%,93529742.00,United States,,15690,Finance,Major Banks
RKDA,Arcadia Biosciences Inc. Common Stock,$3.09,0.09,3.00%,65902423.00,United States,2015,470265,Consumer Non-Durables,Farming/Seeds/Milling
RLAY,Relay Therapeutics Inc. Common Stock,$39.29,-0.37,-0.933%,3535501810.00,United States,2020,575665,Health Care,Biotechnology: Biological Products (No Diagnostic Substances)
RLMD,Relmada Therapeutics Inc. Common Stock,$36.67,0.74,2.06%,595576758.00,United States,,65822,Health Care,Major Pharmaceuticals
RMBI,Richmond Mutual Bancorporation Inc. Common Stock,$14.41,0.11,0.769%,189537526.00,United States,2019,16976,Finance,Major Banks
RMBL,RumbleOn Inc. Class B Common Stock,$38.94,3.55,10.031%,87289189.00,United States,,51590,Technology,EDP Services
RMBS,Rambus Inc. Common Stock,$19.85,-0.35,-1.733%,2217847189.00,United States,1997,466963,Technology,Semiconductors
RMCF,Rocky Mountain Chocolate Factory Inc. Common Stock,$5.80,0.03,0.52%,35230899.00,United States,,42750,Consumer Non-Durables,Specialty Foods
RMGB,RMG Acquisition Corp. II Class A Ordinary Shares,$10.37,-0.01,-0.096%,447206250.00,United States,2021,300812,Finance,Business Services
RMGBU,RMG Acquisition Corp. II Unit,$11.00,0.00,0.00%,0.00,United States,2020,19310,Finance,Business Services
RMGBW,RMG Acquisition Corp. II Warrant,$1.94,-0.06,-3.00%,0.00,United States,2021,137854,Finance,Business Services
RMGCU,RMG Acquisition Corp. III Unit,$10.22,0.01,0.098%,0.00,United States,2021,199702,Finance,Business Services
RMNI,Rimini Street Inc. (DE) Common Stock,$8.23,0.05,0.611%,635399956.00,United States,2015,506121,Miscellaneous,Business Services
RMR,The RMR Group Inc. Class A Common Stock,$41.85,-1.00,-2.334%,686157576.00,United States,,36918,Consumer Services,Professional Services
RMRM,RMR Mortgage Trust Common Stock,$12.26,0.08,0.657%,125076630.00,United States,,36210,,
RMTI,Rockwell Medical Inc. (DE) Common Stock,$1.34,0.01,0.752%,125388041.00,United States,1998,870105,Health Care,Major Pharmaceuticals
RNA,Avidity Biosciences Inc. Common Stock,$25.64,0.02,0.078%,962182819.00,United States,2020,284227,Health Care,Major Pharmaceuticals
RNDB,Randolph Bancorp Inc. Common Stock,$20.30,0.27,1.348%,112127497.00,United States,2016,4767,Finance,Major Banks
RNET,RigNet Inc. Common Stock,$9.86,-0.05,-0.505%,207169535.00,United States,2010,134012,Consumer Services,Telecommunications Equipment
RNLX,Renalytix AI plc American Depositary Shares,$31.01,0.71,2.343%,1117093169.00,United Kingdom,2020,120237,Health Care,Medical Specialities
RNST,Renasant Corporation Common Stock,$46.06,1.22,2.721%,2590347889.00,United States,,341933,Finance,Major Banks
RNWK,RealNetworks Inc. Common Stock,$5.25,0.40,8.247%,200948276.00,United States,1997,950192,Technology,EDP Services
ROAD,Construction Partners Inc. Class A Common Stock,$32.79,1.23,3.897%,1698251319.00,United States,2018,291219,Basic Industries,Military/Government/Technical
ROCC,Roth CH Acquisition II Co. Common Stock,$10.17,-0.13,-1.262%,148990500.00,United States,2021,80242,Finance,Business Services
ROCCU,Roth CH Acquisition II Co. Unit,$10.72,-0.1901,-1.742%,0.00,United States,2020,786,Finance,Business Services
ROCCW,Roth CH Acquisition II Co. Warrant,$1.58,-0.075,-4.532%,0.00,United States,2021,29122,Finance,Business Services
ROCH,Roth CH Acquisition I Co. Common Stock,$26.35,-1.52,-5.454%,258967800.00,United States,2020,327952,Finance,Business Services
ROCHU,Roth CH Acquisition I Co. Unit,$34.50,-0.50,-1.429%,0.00,United States,2020,1933,Finance,Business Services
ROCHW,Roth CH Acquisition I Co. Warrant,$13.00,0.73,5.949%,0.00,United States,2020,120414,Finance,Business Services
ROCK,Gibraltar Industries Inc. Common Stock,$96.98,3.05,3.247%,3158731798.00,United States,1993,233137,Capital Goods,Steel/Iron Ore
ROCRU,Roth CH Acquisition III Co. Unit,$10.03,-0.02,-0.199%,0.00,United States,2021,76687,Finance,Business Services
ROIC,Retail Opportunity Investments Corp. Common Stock (MD),$16.95,0.21,1.254%,2002198122.00,United States,,967551,Consumer Services,Real Estate Investment Trusts
ROKU,Roku Inc. Class A Common Stock,$359.96,-3.38,-0.93%,46226763322.00,United States,2017,2716100,Consumer Services,Television Services
ROLL,RBC Bearings Incorporated Common Stock,$201.00,6.46,3.321%,5053066635.00,United States,2005,122381,Capital Goods,Metal Fabrications
ROOT,Root Inc. Class A Common Stock,$10.99,-0.75,-6.388%,2766129567.00,United States,2020,3665291,Finance,Property-Casualty Insurers
ROST,Ross Stores Inc. Common Stock,$122.62,1.75,1.448%,43709505567.00,United States,1985,2971693,Consumer Services,Clothing/Shoe/Accessory Stores
RP,RealPage Inc. Common Stock,$87.13,-0.12,-0.138%,8895234660.00,United States,2010,1718503,Technology,Computer Software: Prepackaged Software
RPAY,Repay Holdings Corporation Class A Common Stock,$24.94,-0.15,-0.598%,2008334402.00,United States,2018,614403,Miscellaneous,Business Services
RPD,Rapid7 Inc. Common Stock,$79.23,-0.65,-0.814%,4174428407.00,United States,2015,678356,Technology,Computer Software: Prepackaged Software
RPRX,Royalty Pharma plc Class A Ordinary Shares ,$46.92,-0.28,-0.593%,28485642020.00,United States,2020,3670335,Health Care,Major Pharmaceuticals
RPTX,Repare Therapeutics Inc. Common Shares,$27.75,-0.43,-1.526%,1024098377.00,Canada,2020,857549,Health Care,Major Pharmaceuticals
RRBI,Red River Bancshares Inc. Common Stock,$62.72,1.79,2.938%,459444886.00,United States,2019,26541,Finance,Major Banks
RRGB,Red Robin Gourmet Burgers Inc. Common Stock,$37.73,0.55,1.479%,587631431.00,United States,2002,367249,Consumer Services,Restaurants
RRR,Red Rock Resorts Inc. Class A Common Stock,$34.78,0.07,0.202%,4080179946.00,United States,2016,648512,Consumer Services,Hotels/Resorts
RSSS,Research Solutions Inc Common Stock,$2.29,-0.04,-1.717%,60175885.00,United States,,155513,Miscellaneous,Business Services
RSVA,Rodgers Silicon Valley Acquisition Corp. Common Stock,$15.36,0.69,4.703%,441600000.00,United States,2021,200336,Finance,Business Services
RSVAU,Rodgers Silicon Valley Acquisition Corp. Unit,$18.86,1.07,6.015%,0.00,United States,2020,5157,Finance,Business Services
RSVAW,Rodgers Silicon Valley Acquisition Corp. Warrant,$6.88,0.38,5.846%,0.00,United States,2021,10307,Finance,Business Services
RTLR,Rattler Midstream LP Common Units,$10.99,-0.10,-0.902%,1642204697.00,United States,2019,288402,Public Utilities,Natural Gas Distribution
RUBY,Rubius Therapeutics Inc. Common Stock,$16.43,0.54,3.398%,1333819800.00,United States,2018,783690,Health Care,Biotechnology: Biological Products (No Diagnostic Substances)
RUHN,Ruhnn Holding Limited American Depositary Shares,$3.41,0.00,0.00%,281853632.00,China,2019,32191,Consumer Services,Catalog/Specialty Distribution
RUN,Sunrun Inc. Common Stock,$62.29,-1.17,-1.844%,12618936991.00,United States,2015,5101192,Capital Goods,Industrial Specialties
RUSHA,Rush Enterprises Inc. Common Stock Cl A,$50.08,1.405,2.886%,2758138923.00,United States,,255861,Consumer Durables,Automotive Aftermarket
RUSHB,Rush Enterprises Inc. Class B,$46.28,1.04,2.299%,2548855219.00,United States,,13384,Consumer Durables,Automotive Aftermarket
RUTH,Ruth's Hospitality Group Inc. Common Stock,$26.43,0.64,2.482%,924032894.00,United States,2005,543025,Consumer Services,Restaurants
RVMD,Revolution Medicines Inc. Common Stock,$47.57,0.38,0.805%,3490839109.00,United States,2020,698882,Health Care,Biotechnology: Biological Products (No Diagnostic Substances)
RVNC,Revance Therapeutics Inc. Common Stock,$27.76,0.59,2.172%,1939013070.00,United States,2014,361960,Health Care,Major Pharmaceuticals
RVPH,Reviva Pharmaceuticals Holdings Inc. Common Stock ,$8.48,0.025,0.296%,43541009.00,United States,2020,6779,Health Care,Major Pharmaceuticals
RVPHW,Reviva Pharmaceuticals Holdings Inc. Warrants,$0.6498,-0.0401,-5.812%,0.00,United States,2018,5344,Health Care,Major Pharmaceuticals
RVSB,Riverview Bancorp Inc Common Stock,$7.40,0.00,0.00%,165354739.00,United States,,71583,Finance,Savings Institutions
RWLK,ReWalk Robotics Ltd. Ordinary Shares,$3.13,0.01,0.321%,138868572.00,Israel,2014,1690001,Health Care,Industrial Specialties
RXDX,Prometheus Biosciences Inc. Common Stock,$25.29,6.29,33.105%,0.00,United States,,3923615,,
RXRAU,RXR Acquisition Corp. Units,$9.995,-0.015,-0.15%,0.00,United States,2021,96020,Finance,Business Services
RXT,Rackspace Technology Inc. Common Stock,$20.55,-0.38,-1.816%,4223495944.00,United States,2020,498053,Technology,Computer Software: Programming Data Processing
RYAAY,Ryanair Holdings plc American Depositary Shares,$110.30,-0.11,-0.10%,24876113972.00,Ireland,1997,303356,Transportation,Air Freight/Delivery Services
RYTM,Rhythm Pharmaceuticals Inc. Common Stock,$26.09,-0.64,-2.394%,1309226569.00,United States,2017,217634,Health Care,Major Pharmaceuticals
RZLT,Rezolute Inc. Common Stock,$9.11,-0.31,-3.291%,76089243.00,United States,,12374,Health Care,Major Pharmaceuticals
SABR,Sabre Corporation Common Stock,$16.27,0.27,1.688%,5162924331.00,United States,2014,5534973,Technology,Computer Software: Programming Data Processing
SABRP,Sabre Corporation 6.50% Series A Mandatory Convertible Preferred Stock,$204.69,0.10,0.049%,,United States,,26404,Technology,Computer Software: Programming Data Processing
SAFM,Sanderson Farms Inc. Common Stock,$164.20,0.45,0.275%,3666650695.00,United States,1987,181156,Consumer Non-Durables,Meat/Poultry/Fish
SAFT,Safety Insurance Group Inc. Common Stock,$85.38,0.89,1.053%,1271623935.00,United States,2002,74296,Finance,Property-Casualty Insurers
SAGE,Sage Therapeutics Inc. Common Stock,$78.72,-1.18,-1.477%,4595825766.00,United States,2014,284791,Health Care,Major Pharmaceuticals
SAIA,Saia Inc. Common Stock,$218.75,1.18,0.542%,5759619469.00,United States,,228439,Transportation,Trucking Freight/Courier Services
SAII,Software Acquisition Group Inc. II Class A Common Stock,$10.51,-0.25,-2.323%,226621875.00,United States,2020,146624,Finance,Business Services
SAIIU,Software Acquisition Group Inc. II Unit,$11.48,-0.49,-4.094%,0.00,United States,2020,1181,Finance,Business Services
SAIIW,Software Acquisition Group Inc. II Warrant,$1.93,0.03,1.579%,0.00,United States,2020,106910,Finance,Business Services
SAL,Salisbury Bancorp Inc. Common Stock,$47.87,-3.01,-5.916%,136108388.00,United States,,9424,Finance,Savings Institutions
SALM,Salem Media Group Inc. Class A Common Stock,$3.57,0.34,10.526%,95263176.00,United States,1999,1459866,Consumer Services,Broadcasting
SAMG,Silvercrest Asset Management Group Inc. Class A Common Stock,$15.25,-0.05,-0.327%,220056463.00,United States,2013,37057,Finance,Investment Managers
